{
  "schema_version": "1",
  "github_repo_url": "https://github.com/sadeeshasathsara/ethical-tourism-certification-system-backend",
  "project": {
    "project_id": "P-ETCS",
    "project_name": "Ethical Tourism Certification System Backend",
    "project_domain": ""
  },
  "students": [
    {
      "student_id": "STU-001",
      "name": "Nipun Dhananjaya",
      "email": "nipundananjaya9001@gmail.com"
    },
    {
      "student_id": "STU-002",
      "name": "Sadeesha Sathsara",
      "email": "sathsarakumbukage@gmail.com"
    },
    {
      "student_id": "STU-003",
      "name": "Chathush Vishmika",
      "email": "chathushuni@gmail.com"
    },
    {
      "student_id": "STU-004",
      "name": "Croos Eric Devon",
      "email": "ericdevon2003@gmail.com"
    }
  ],
  "sprints": [
    {
      "sprint_id": "sprint-01",
      "name": "Foundation and Backend Architecture",
      "goal": "Establish the Express/Mongo feature-module architecture, shared common utilities, and initial certificate lifecycle API surface.",
      "start_date": "2026-02-08",
      "end_date": "2026-02-21",
      "status": "completed"
    },
    {
      "sprint_id": "sprint-02",
      "name": "Search Discovery, Audit Core, and Authentication",
      "goal": "Ship public hotel search/AI recommendations, core audit + RAG document chat, JWT auth, and early trust-score/email lifecycle hooks.",
      "start_date": "2026-02-22",
      "end_date": "2026-03-07",
      "status": "completed"
    },
    {
      "sprint_id": "sprint-03",
      "name": "Certificate Lifecycle Depth",
      "goal": "Deepen certificate lifecycle: activity timeline, hotel-enriched certificate reads, full update API, and trust-score fixes.",
      "start_date": "2026-03-08",
      "end_date": "2026-03-29",
      "status": "completed"
    },
    {
      "sprint_id": "sprint-04",
      "name": "Owner Portal, Certificate Documents, and Release Hardening",
      "goal": "Generate/email certificate PDFs, expose owner download and admin stats, finish application/lifecycle features, and harden tests plus deployment docs for release.",
      "start_date": "2026-03-30",
      "end_date": "2026-04-12",
      "status": "completed"
    }
  ],
  "tasks": [
    {
      "task_id": "task-s1-initial-repo",
      "title": "Initialize backend repository",
      "description": "Create the initial commit and repository baseline for the ethical tourism certification backend.",
      "status": "done",
      "priority": "high",
      "assignee_ids": [
        "STU-001"
      ],
      "acceptance_criteria": [
        "Repository exists with initial commit",
        "Project can be cloned and opened by the team"
      ],
      "labels": [
        "backend",
        "infrastructure"
      ],
      "story_points": 2,
      "sprint_id": "sprint-01",
      "subtask_count": 0,
      "linked_commits": [],
      "completed_by": null,
      "carried_over_from": null
    },
    {
      "task_id": "task-s1-architecture",
      "title": "Establish feature-based backend architecture",
      "description": "Scaffold core modules, common utilities, middleware patterns, and test infrastructure (Sadeesha: architecture commit 2026-02-08).",
      "status": "done",
      "priority": "high",
      "assignee_ids": [
        "STU-002"
      ],
      "acceptance_criteria": [
        "common/, modules/, and app entrypoints exist",
        "Shared utilities and middleware layout are in place",
        "Test infrastructure folder structure is ready"
      ],
      "labels": [
        "backend",
        "architecture"
      ],
      "story_points": 8,
      "sprint_id": "sprint-01",
      "subtask_count": 0,
      "linked_commits": [],
      "completed_by": null,
      "carried_over_from": null
    },
    {
      "task_id": "task-s1-lifecycle-apis",
      "title": "Implement initial certificate lifecycle APIs",
      "description": "Deliver the first certificate lifecycle endpoints (Chathush: 'Implemented the lifecycle apis', 2026-02-17).",
      "status": "done",
      "priority": "high",
      "assignee_ids": [
        "STU-003"
      ],
      "acceptance_criteria": [
        "Lifecycle routes are mounted under /certification",
        "Basic issue/get certificate operations work"
      ],
      "labels": [
        "backend",
        "lifecycle"
      ],
      "story_points": 5,
      "sprint_id": "sprint-01",
      "subtask_count": 0,
      "linked_commits": [],
      "completed_by": null,
      "carried_over_from": null
    },
    {
      "task_id": "task-s1-common-models",
      "title": "Define shared User and Hotel models",
      "description": "Place shared Mongoose models in common/models for use across certification, audit, and search modules.",
      "status": "done",
      "priority": "medium",
      "assignee_ids": [
        "STU-002",
        "STU-004"
      ],
      "acceptance_criteria": [
        "User model supports Admin, Hotel Owner, Auditor, Tourist roles",
        "Hotel model is reusable across modules"
      ],
      "labels": [
        "backend",
        "models"
      ],
      "story_points": 5,
      "sprint_id": "sprint-01",
      "subtask_count": 0,
      "linked_commits": [],
      "completed_by": null,
      "carried_over_from": null
    },
    {
      "task_id": "task-s2-search-ai",
      "title": "Enhance hotel search and AI recommendations",
      "description": "Improve hotel recommendation scoring with feedback summaries and search/feedback service logging (Nipun: AI-Recommendation + logging commits, 2026-02-26).",
      "status": "done",
      "priority": "high",
      "assignee_ids": [
        "STU-001"
      ],
      "acceptance_criteria": [
        "/hotels-search/ai-recommendations returns ranked hotels",
        "Feedback summaries influence recommendation scoring",
        "Search services emit traceable logs"
      ],
      "labels": [
        "backend",
        "search",
        "ai"
      ],
      "story_points": 8,
      "sprint_id": "sprint-02",
      "subtask_count": 0,
      "linked_commits": [],
      "completed_by": null,
      "carried_over_from": null
    },
    {
      "task_id": "task-s2-vercel",
      "title": "Add Vercel serverless deployment entrypoint",
      "description": "Add vercel.json and api/index.js; fix Node runtime/builds (Nipun: deployment commits, 2026-02-26).",
      "status": "done",
      "priority": "high",
      "assignee_ids": [
        "STU-001"
      ],
      "acceptance_criteria": [
        "api/index.js exports the Express app",
        "Vercel config uses a supported Node runtime",
        "Deployed health endpoint responds"
      ],
      "labels": [
        "backend",
        "deployment"
      ],
      "story_points": 5,
      "sprint_id": "sprint-02",
      "subtask_count": 0,
      "linked_commits": [],
      "completed_by": null,
      "carried_over_from": null
    },
    {
      "task_id": "task-s2-audit-core",
      "title": "Implement audit management and RAG document chat",
      "description": "Create audit endpoints (create/retrieve/review/compliance), document processing, and hotel-data chatbot (Eric: audit feature commits, 2026-02-26).",
      "status": "done",
      "priority": "high",
      "assignee_ids": [
        "STU-004"
      ],
      "acceptance_criteria": [
        "Audits can be created and reviewed by section",
        "Compliance checks can be added",
        "Uploaded hotel documents support chatWithHotelData"
      ],
      "labels": [
        "backend",
        "audit",
        "ai"
      ],
      "story_points": 13,
      "sprint_id": "sprint-02",
      "subtask_count": 0,
      "linked_commits": [],
      "completed_by": null,
      "carried_over_from": null
    },
    {
      "task_id": "task-s2-vector-db",
      "title": "Refactor vector DB embeddings to MongoDB",
      "description": "Store audit document embeddings in MongoDB (Eric: vector database refactor, 2026-02-27).",
      "status": "done",
      "priority": "medium",
      "assignee_ids": [
        "STU-004"
      ],
      "acceptance_criteria": [
        "Embeddings persist in MongoDB",
        "Document chat retrieves relevant chunks"
      ],
      "labels": [
        "backend",
        "audit",
        "database"
      ],
      "story_points": 5,
      "sprint_id": "sprint-02",
      "subtask_count": 0,
      "linked_commits": [],
      "completed_by": null,
      "carried_over_from": null
    },
    {
      "task_id": "task-s2-auth",
      "title": "Implement JWT registration, login, and user retrieval",
      "description": "Deliver /auth/register, /auth/login, and user retrieval (Eric: authentication system commit, 2026-04-11; Sadeesha later added Admin user listing).",
      "status": "done",
      "priority": "high",
      "assignee_ids": [
        "STU-004",
        "STU-002"
      ],
      "acceptance_criteria": [
        "Users can register and login with JWT",
        "Protected routes use protect middleware",
        "Admin can list users via /auth/users"
      ],
      "labels": [
        "backend",
        "authentication"
      ],
      "story_points": 8,
      "sprint_id": "sprint-02",
      "subtask_count": 0,
      "linked_commits": [],
      "completed_by": null,
      "carried_over_from": null
    },
    {
      "task_id": "task-s2-trust-feedback",
      "title": "Auto-update trust score from tourist feedback",
      "description": "When feedback is submitted, update certificate trust score and expose a trust-score update API (Chathush: 2026-02-24).",
      "status": "done",
      "priority": "high",
      "assignee_ids": [
        "STU-003"
      ],
      "acceptance_criteria": [
        "Feedback submission updates related trust score",
        "Trust score update API validates score bounds",
        "Only eligible hotels can be issued certificates"
      ],
      "labels": [
        "backend",
        "lifecycle",
        "feedback"
      ],
      "story_points": 5,
      "sprint_id": "sprint-02",
      "subtask_count": 0,